{
  "authority": true,
  "candidate_order": [
    {
      "basis": "explicit current House Tang heir status",
      "person_id": "char_tang_wei"
    }
  ],
  "current_holder_id": "char_tang_zhu",
  "schema": "family-succession",
  "status": "active",
  "subject_owner_id": "institution_house_tang",
  "succession_id": "succession.house_tang"
}
